{"command": "check", "config": "/home/wavy/ai/caliper-ui/validation/acist.caliper.json", "error": null, "image": "/home/wavy/ai/caliper-ui/cli-debug-inputs/acist-1280x800-playwright.png", "meta": {"cache_hit": false, "cli_version": "1.0.0", "command": "check", "config_path": "/home/wavy/ai/caliper-ui/validation/acist.caliper.json", "config_sha256": "9a7abc1c979afd2df123d192ed7fc8459edd9304d8eda5d042a706fea012ee69", "elements_detected": 0, "image_height": 800, "image_path": "/home/wavy/ai/caliper-ui/cli-debug-inputs/acist-1280x800-playwright.png", "image_sha256": "8390d7f9e60f11a45013f9e50675eb3d0688cc82554be3a46589925f3ed688be", "image_width": 1280, "omniparser_version": "b0d5c9f-dirty", "parse_performed": false, "parse_required": false, "processing_time_ms": 39, "request_id": "bb3531f98c754030bfa72dac1e3b64d1", "timestamp_utc": "2026-03-22T23:12:25Z"}, "request_id": "bb3531f98c754030bfa72dac1e3b64d1", "result": "pass", "results": [{"actual": 492.0, "delta": 0.0, "description": "e-0db25b4d6de100e7 width baseline", "details": "PASS: region 'e-0db25b4d6de100e7' width is 492px, expected 492px ±5px (delta +0px).", "expected": 492.0, "id": "region-e-0db25b4d6de100e7-width", "passed": true, "tolerance": 5.0, "type": "region_dimension"}, {"actual": 32.0, "delta": 0.0, "description": "e-0db25b4d6de100e7 height baseline", "details": "PASS: region 'e-0db25b4d6de100e7' height is 32px, expected 32px ±5px (delta +0px).", "expected": 32.0, "id": "region-e-0db25b4d6de100e7-height", "passed": true, "tolerance": 5.0, "type": "region_dimension"}, {"actual": 85.0, "delta": 0.0, "description": "e-b53e5c16e959539d width baseline", "details": "PASS: region 'e-b53e5c16e959539d' width is 85px, expected 85px ±5px (delta +0px).", "expected": 85.0, "id": "region-e-b53e5c16e959539d-width", "passed": true, "tolerance": 5.0, "type": "region_dimension"}, {"actual": 19.0, "delta": 0.0, "description": "e-b53e5c16e959539d height baseline", "details": "PASS: region 'e-b53e5c16e959539d' height is 19px, expected 19px ±5px (delta +0px).", "expected": 19.0, "id": "region-e-b53e5c16e959539d-height", "passed": true, "tolerance": 5.0, "type": "region_dimension"}, {"actual": 72.0, "delta": 0.0, "description": "e-0039ae2fb750af49 width baseline", "details": "PASS: region 'e-0039ae2fb750af49' width is 72px, expected 72px ±5px (delta +0px).", "expected": 72.0, "id": "region-e-0039ae2fb750af49-width", "passed": true, "tolerance": 5.0, "type": "region_dimension"}, {"actual": 34.0, "delta": 0.0, "description": "e-0039ae2fb750af49 height baseline", "details": "PASS: region 'e-0039ae2fb750af49' height is 34px, expected 34px ±5px (delta +0px).", "expected": 34.0, "id": "region-e-0039ae2fb750af49-height", "passed": true, "tolerance": 5.0, "type": "region_dimension"}, {"actual": 113.0, "delta": 0.0, "description": "e-c177e9032cba0d50 width baseline", "details": "PASS: region 'e-c177e9032cba0d50' width is 113px, expected 113px ±5px (delta +0px).", "expected": 113.0, "id": "region-e-c177e9032cba0d50-width", "passed": true, "tolerance": 5.0, "type": "region_dimension"}, {"actual": 19.0, "delta": 0.0, "description": "e-c177e9032cba0d50 height baseline", "details": "PASS: region 'e-c177e9032cba0d50' height is 19px, expected 19px ±5px (delta +0px).", "expected": 19.0, "id": "region-e-c177e9032cba0d50-height", "passed": true, "tolerance": 5.0, "type": "region_dimension"}, {"actual": 58.0, "delta": 0.0, "description": "e-da9d4afa215608c9 width baseline", "details": "PASS: region 'e-da9d4afa215608c9' width is 58px, expected 58px ±5px (delta +0px).", "expected": 58.0, "id": "region-e-da9d4afa215608c9-width", "passed": true, "tolerance": 5.0, "type": "region_dimension"}, {"actual": 32.0, "delta": 0.0, "description": "e-da9d4afa215608c9 height baseline", "details": "PASS: region 'e-da9d4afa215608c9' height is 32px, expected 32px ±5px (delta +0px).", "expected": 32.0, "id": "region-e-da9d4afa215608c9-height", "passed": true, "tolerance": 5.0, "type": "region_dimension"}, {"actual": 81.0, "delta": 0.0, "description": "e-87ef3ca480209a1d width baseline", "details": "PASS: region 'e-87ef3ca480209a1d' width is 81px, expected 81px ±5px (delta +0px).", "expected": 81.0, "id": "region-e-87ef3ca480209a1d-width", "passed": true, "tolerance": 5.0, "type": "region_dimension"}, {"actual": 33.0, "delta": 0.0, "description": "e-87ef3ca480209a1d height baseline", "details": "PASS: region 'e-87ef3ca480209a1d' height is 33px, expected 33px ±5px (delta +0px).", "expected": 33.0, "id": "region-e-87ef3ca480209a1d-height", "passed": true, "tolerance": 5.0, "type": "region_dimension"}, {"actual": 40.0, "delta": 0.0, "description": "e-dbc038a7a1bc5a5c width baseline", "details": "PASS: region 'e-dbc038a7a1bc5a5c' width is 40px, expected 40px ±5px (delta +0px).", "expected": 40.0, "id": "region-e-dbc038a7a1bc5a5c-width", "passed": true, "tolerance": 5.0, "type": "region_dimension"}, {"actual": 18.0, "delta": 0.0, "description": "e-dbc038a7a1bc5a5c height baseline", "details": "PASS: region 'e-dbc038a7a1bc5a5c' height is 18px, expected 18px ±5px (delta +0px).", "expected": 18.0, "id": "region-e-dbc038a7a1bc5a5c-height", "passed": true, "tolerance": 5.0, "type": "region_dimension"}, {"actual": 24.0, "delta": 0.0, "description": "e-0166f2840d634fc2 width baseline", "details": "PASS: region 'e-0166f2840d634fc2' width is 24px, expected 24px ±5px (delta +0px).", "expected": 24.0, "id": "region-e-0166f2840d634fc2-width", "passed": true, "tolerance": 5.0, "type": "region_dimension"}, {"actual": 17.0, "delta": 0.0, "description": "e-0166f2840d634fc2 height baseline", "details": "PASS: region 'e-0166f2840d634fc2' height is 17px, expected 17px ±5px (delta +0px).", "expected": 17.0, "id": "region-e-0166f2840d634fc2-height", "passed": true, "tolerance": 5.0, "type": "region_dimension"}, {"actual": 98.0, "delta": 0.0, "description": "e-cb18bf1ea08650d2 width baseline", "details": "PASS: region 'e-cb18bf1ea08650d2' width is 98px, expected 98px ±5px (delta +0px).", "expected": 98.0, "id": "region-e-cb18bf1ea08650d2-width", "passed": true, "tolerance": 5.0, "type": "region_dimension"}, {"actual": 23.0, "delta": 0.0, "description": "e-cb18bf1ea08650d2 height baseline", "details": "PASS: region 'e-cb18bf1ea08650d2' height is 23px, expected 23px ±5px (delta +0px).", "expected": 23.0, "id": "region-e-cb18bf1ea08650d2-height", "passed": true, "tolerance": 5.0, "type": "region_dimension"}, {"actual": 28.0, "delta": 0.0, "description": "e-5839426cf18dd47f width baseline", "details": "PASS: region 'e-5839426cf18dd47f' width is 28px, expected 28px ±5px (delta +0px).", "expected": 28.0, "id": "region-e-5839426cf18dd47f-width", "passed": true, "tolerance": 5.0, "type": "region_dimension"}, {"actual": 16.0, "delta": 0.0, "description": "e-5839426cf18dd47f height baseline", "details": "PASS: region 'e-5839426cf18dd47f' height is 16px, expected 16px ±5px (delta +0px).", "expected": 16.0, "id": "region-e-5839426cf18dd47f-height", "passed": true, "tolerance": 5.0, "type": "region_dimension"}, {"actual": 65.0, "delta": 0.0, "description": "e-8c2e6d1f7c9f47b7 width baseline", "details": "PASS: region 'e-8c2e6d1f7c9f47b7' width is 65px, expected 65px ±5px (delta +0px).", "expected": 65.0, "id": "region-e-8c2e6d1f7c9f47b7-width", "passed": true, "tolerance": 5.0, "type": "region_dimension"}, {"actual": 42.0, "delta": 0.0, "description": "e-8c2e6d1f7c9f47b7 height baseline", "details": "PASS: region 'e-8c2e6d1f7c9f47b7' height is 42px, expected 42px ±5px (delta +0px).", "expected": 42.0, "id": "region-e-8c2e6d1f7c9f47b7-height", "passed": true, "tolerance": 5.0, "type": "region_dimension"}, {"actual": 76.0, "delta": 0.0, "description": "e-d66e3a0ddb16f50b width baseline", "details": "PASS: region 'e-d66e3a0ddb16f50b' width is 76px, expected 76px ±5px (delta +0px).", "expected": 76.0, "id": "region-e-d66e3a0ddb16f50b-width", "passed": true, "tolerance": 5.0, "type": "region_dimension"}, {"actual": 46.0, "delta": 0.0, "description": "e-d66e3a0ddb16f50b height baseline", "details": "PASS: region 'e-d66e3a0ddb16f50b' height is 46px, expected 46px ±5px (delta +0px).", "expected": 46.0, "id": "region-e-d66e3a0ddb16f50b-height", "passed": true, "tolerance": 5.0, "type": "region_dimension"}, {"actual": 23.0, "delta": 0.0, "description": "e-ad2b980831d94640 width baseline", "details": "PASS: region 'e-ad2b980831d94640' width is 23px, expected 23px ±5px (delta +0px).", "expected": 23.0, "id": "region-e-ad2b980831d94640-width", "passed": true, "tolerance": 5.0, "type": "region_dimension"}, {"actual": 16.0, "delta": 0.0, "description": "e-ad2b980831d94640 height baseline", "details": "PASS: region 'e-ad2b980831d94640' height is 16px, expected 16px ±5px (delta +0px).", "expected": 16.0, "id": "region-e-ad2b980831d94640-height", "passed": true, "tolerance": 5.0, "type": "region_dimension"}, {"actual": 161.0, "delta": 0.0, "description": "e-32dca882d8bfa19b width baseline", "details": "PASS: region 'e-32dca882d8bfa19b' width is 161px, expected 161px ±5px (delta +0px).", "expected": 161.0, "id": "region-e-32dca882d8bfa19b-width", "passed": true, "tolerance": 5.0, "type": "region_dimension"}, {"actual": 20.0, "delta": 0.0, "description": "e-32dca882d8bfa19b height baseline", "details": "PASS: region 'e-32dca882d8bfa19b' height is 20px, expected 20px ±5px (delta +0px).", "expected": 20.0, "id": "region-e-32dca882d8bfa19b-height", "passed": true, "tolerance": 5.0, "type": "region_dimension"}, {"actual": 154.0, "delta": 0.0, "description": "e-565936294f90ee7f width baseline", "details": "PASS: region 'e-565936294f90ee7f' width is 154px, expected 154px ±5px (delta +0px).", "expected": 154.0, "id": "region-e-565936294f90ee7f-width", "passed": true, "tolerance": 5.0, "type": "region_dimension"}, {"actual": 17.0, "delta": 0.0, "description": "e-565936294f90ee7f height baseline", "details": "PASS: region 'e-565936294f90ee7f' height is 17px, expected 17px ±5px (delta +0px).", "expected": 17.0, "id": "region-e-565936294f90ee7f-height", "passed": true, "tolerance